{"acquisition_session_id":"acq_hist001_20260724","candidate_id":"candidate_a886d1c1509640022197f00b","content_authorship":"repository_authored","content_ref":{"kind":"evidence_blob","media_type":"text/plain","sha256":"8928c7d0492a013bf3fb4cca138461208d1b90ecfe5c364d6bd102a86cd519e8","size_bytes":520,"uri":"tracelane://evidence/blobs/sha256/8928c7d0492a013bf3fb4cca138461208d1b90ecfe5c364d6bd102a86cd519e8"},"content_sha256":"8928c7d0492a013bf3fb4cca138461208d1b90ecfe5c364d6bd102a86cd519e8","curator":"codex-manual","date_precision":"day","document_date":"1807-12-17","domains":["economy","imperial-governance"],"fact_ids":["economy.continental_system_scope","economy.neutral_shipping_exposure","imperial_governance.allied_enforcement"],"license_basis":"Repository-authored paraphrase of public-domain decrees; the source identifies the historical editions and translations.","project_id":"hist-001","query":"\"Berlin Decree\" \"Milan Decree\" full text public domain","record_sha256":"4a7545032c2a5490fd6bb6e3f77dbeca572e658058d1de110f277adf7e538b7c","retention_policy":"paraphrase_only","retrieved_at":"2026-07-24T12:00:00Z","role":"evidence","schema_id":"tracelane://schemas/project-evidence-candidate/v1","schema_version":"1.0.0","source_candidate_content_sha256":"8928c7d0492a013bf3fb4cca138461208d1b90ecfe5c364d6bd102a86cd519e8","source_candidate_id":"candidate_a886d1c1509640022197f00b","source_candidate_record_sha256":"818562df99cc27fb83bf0aecde6e1ede6441eb757854e6b3041794fdd6b3999b","source_candidate_uri":"tracelane://artifacts/acquisition/acq_hist001_20260724/candidates/candidate_a886d1c1509640022197f00b.json","source_spec_id":"hist001_continental_system_decrees","source_type":"primary","source_url":"https://www.napoleon-series.org/research/government/diplomatic/c_continental.html","title":"Documents upon the Continental System: Berlin and Milan Decrees","transformation_refs":[],"trust_level":"untrusted_external"}
