{"acquisition_session_id":"acq_hist001_20260724","candidate_id":"candidate_819bf107d321427970ba8953","content_authorship":"repository_authored","content_ref":{"kind":"evidence_blob","media_type":"text/plain","sha256":"adf039505c7f6b9315349541db3be647bbe6e4bc2aaafe5180be1630f3571954","size_bytes":423,"uri":"tracelane://evidence/blobs/sha256/adf039505c7f6b9315349541db3be647bbe6e4bc2aaafe5180be1630f3571954"},"content_sha256":"adf039505c7f6b9315349541db3be647bbe6e4bc2aaafe5180be1630f3571954","curator":"codex-manual","date_precision":"day","document_date":"1810-12-13","domains":["imperial-governance","military"],"fact_ids":["imperial_governance.reserve_and_department_allocation","military.conscription_scale_1811"],"license_basis":"Repository-authored paraphrase of a public-domain proposed decree and tables.","project_id":"hist-001","query":"French conscription allied contingents decree 1811 1812 primary source","record_sha256":"221310d0d4090c08637f0c38c1560cfc92540b114387c0474fe5c378c1dc5312","retention_policy":"paraphrase_only","retrieved_at":"2026-07-24T12:00:00Z","role":"evidence","schema_id":"tracelane://schemas/project-evidence-candidate/v1","schema_version":"1.0.0","source_candidate_content_sha256":"adf039505c7f6b9315349541db3be647bbe6e4bc2aaafe5180be1630f3571954","source_candidate_id":"candidate_819bf107d321427970ba8953","source_candidate_record_sha256":"b2322e787f56c19e98a588ad5a780bc3f5a51ff4a236d042c3beaaa7458c57e9","source_candidate_uri":"tracelane://artifacts/acquisition/acq_hist001_20260724/candidates/candidate_819bf107d321427970ba8953.json","source_spec_id":"hist001_french_conscription_1811","source_type":"primary","source_url":"https://www.napoleon-series.org/military-info/organization/France/Conscription/1811/c_conscripts1811.html","title":"Council of State recommendation on the 1811 conscription","transformation_refs":[],"trust_level":"untrusted_external"}
