{"acquisition_session_id":"acq_hist001_20260724","candidate_id":"candidate_fce1daafae049933747fef6f","content_authorship":"repository_authored","content_ref":{"kind":"evidence_blob","media_type":"text/plain","sha256":"2669b2282220c6fbdb2c16c14d4470ba99a3f1299ff911df5d66a977c424c1a3","size_bytes":452,"uri":"tracelane://evidence/blobs/sha256/2669b2282220c6fbdb2c16c14d4470ba99a3f1299ff911df5d66a977c424c1a3"},"content_sha256":"2669b2282220c6fbdb2c16c14d4470ba99a3f1299ff911df5d66a977c424c1a3","curator":"codex-manual","date_precision":"day","document_date":"1807-07-09","domains":["diplomacy","economy"],"fact_ids":["diplomacy.duchy_of_warsaw","diplomacy.tilsit_settlement","economy.british_trade_exclusion"],"license_basis":"Repository-authored paraphrase of a public-domain treaty and public-domain contemporary translation.","project_id":"hist-001","query":"\"Treaty of Tilsit\" 1807 full text public domain","record_sha256":"d595f751ea3b26751ccd30ff916050f20d956c3b6c5591ac4847ca96747fe2fd","retention_policy":"paraphrase_only","retrieved_at":"2026-07-24T12:00:00Z","role":"evidence","schema_id":"tracelane://schemas/project-evidence-candidate/v1","schema_version":"1.0.0","source_candidate_content_sha256":"2669b2282220c6fbdb2c16c14d4470ba99a3f1299ff911df5d66a977c424c1a3","source_candidate_id":"candidate_fce1daafae049933747fef6f","source_candidate_record_sha256":"bca0c3324d634a2cd2df03f6a806a7bfca31048a84f5223a8a068e6895c7297e","source_candidate_uri":"tracelane://artifacts/acquisition/acq_hist001_20260724/candidates/candidate_fce1daafae049933747fef6f.json","source_spec_id":"hist001_tilsit_treaty","source_type":"primary","source_url":"https://en.wikisource.org/wiki/Treaty_of_Tilsit%2C_9_July_1807","title":"Treaty of Tilsit, 9 July 1807","transformation_refs":[],"trust_level":"untrusted_external"}
