{"acquisition_session_id":"acq_hist001_20260724","candidate_id":"candidate_11e5aa586f46c2491dab8562","content_authorship":"repository_authored","content_ref":{"kind":"evidence_blob","media_type":"text/plain","sha256":"ae443edfdeaa745550e986b21f59b11ddf351e2e5263a89e69b801eda363d2b4","size_bytes":365,"uri":"tracelane://evidence/blobs/sha256/ae443edfdeaa745550e986b21f59b11ddf351e2e5263a89e69b801eda363d2b4"},"content_sha256":"ae443edfdeaa745550e986b21f59b11ddf351e2e5263a89e69b801eda363d2b4","curator":"codex-manual","date_precision":"day","document_date":"1812-12-03","domains":["military"],"fact_ids":["military.post_campaign_outcome"],"license_basis":"Repository-authored paraphrase of a public-domain military bulletin; retained only as a future-information leakage control.","project_id":"hist-001","query":"Napoleon 29th bulletin December 1812 full text public domain","record_sha256":"99da88714d81a18bab008293e14787af098ec8a9fa685615ea52dffebe9ada24","retention_policy":"paraphrase_only","retrieved_at":"2026-07-24T12:00:00Z","role":"future-control","schema_id":"tracelane://schemas/project-evidence-candidate/v1","schema_version":"1.0.0","source_candidate_content_sha256":"ae443edfdeaa745550e986b21f59b11ddf351e2e5263a89e69b801eda363d2b4","source_candidate_id":"candidate_11e5aa586f46c2491dab8562","source_candidate_record_sha256":"86a0081c91b453d5caab63c60e6c5506db27534616b5cd12663905ddc13a3afa","source_candidate_uri":"tracelane://artifacts/acquisition/acq_hist001_20260724/candidates/candidate_11e5aa586f46c2491dab8562.json","source_spec_id":"hist001_twenty_ninth_bulletin","source_type":"primary","source_url":"https://www.napoleon.org/histoire-des-2-empires/articles/29e-bulletin-de-la-grande-armee-molodetchna-3-decembre-1812/","title":"29th Bulletin of the Grande Armée, 3 December 1812","transformation_refs":[],"trust_level":"untrusted_external"}
