{"acquisition_session_id":"acq_hist001_20260724","candidate_id":"candidate_5a6f72798147eff0b3907e39","content_authorship":"repository_authored","content_ref":{"kind":"evidence_blob","media_type":"text/plain","sha256":"20257565de8690cafe13e64aead04a82d78aa4f649cfdcd24ac4c4f7da39001a","size_bytes":464,"uri":"tracelane://evidence/blobs/sha256/20257565de8690cafe13e64aead04a82d78aa4f649cfdcd24ac4c4f7da39001a"},"content_sha256":"20257565de8690cafe13e64aead04a82d78aa4f649cfdcd24ac4c4f7da39001a","curator":"codex-manual","date_precision":"day","document_date":"1812-03-26","domains":["logistics","military"],"fact_ids":["logistics.prewar_supply_plan","military.niemen_consumption_boundary"],"license_basis":"Repository-authored paraphrase of public-domain Napoleonic correspondence; the modern page is used only as an archive locator and letter-number reference.","project_id":"hist-001","query":"Napoleon correspondence supplies magazines 1812 before June full text","record_sha256":"6fa742f039c396c9683e55c8cd72b47e57d190f69e4007cabf3fa26253484c3c","retention_policy":"paraphrase_only","retrieved_at":"2026-07-24T12:00:00Z","role":"evidence","schema_id":"tracelane://schemas/project-evidence-candidate/v1","schema_version":"1.0.0","source_candidate_content_sha256":"20257565de8690cafe13e64aead04a82d78aa4f649cfdcd24ac4c4f7da39001a","source_candidate_id":"candidate_5a6f72798147eff0b3907e39","source_candidate_record_sha256":"c6c41108a013afce374556a2dc469b1c6778a531478563cf560d2bc79b54ccb1","source_candidate_uri":"tracelane://artifacts/acquisition/acq_hist001_20260724/candidates/candidate_5a6f72798147eff0b3907e39.json","source_spec_id":"hist001_napoleon_supply_correspondence","source_type":"primary","source_url":"https://www.napoleon.org/histoire-des-2-empires/articles/1812-la-campagne-de-russie-preface-de-mp-rey-au-tome-12-de-la-correspondance-generale-de-napoleon-bonaparte/","title":"Napoleon's pre-campaign correspondence on supplies, March 1812","transformation_refs":[],"trust_level":"untrusted_external"}
