{"acquisition_session_id":"acq_hist001_20260724","candidate_id":"candidate_73605662756b5b352e0c7b63","content_authorship":"repository_authored","content_ref":{"kind":"evidence_blob","media_type":"text/plain","sha256":"9d556c77aeaadfdfcc59bcbdce0ed95825dc89427f0feb44beaa87661b7a7fdc","size_bytes":508,"uri":"tracelane://evidence/blobs/sha256/9d556c77aeaadfdfcc59bcbdce0ed95825dc89427f0feb44beaa87661b7a7fdc"},"content_sha256":"9d556c77aeaadfdfcc59bcbdce0ed95825dc89427f0feb44beaa87661b7a7fdc","curator":"codex-manual","date_precision":"day","document_date":"1810-12-19","domains":["diplomacy","economy"],"fact_ids":["diplomacy.franco_russian_trade_friction","economy.russian_trade_rules_1811"],"license_basis":"Repository-authored paraphrase using the Presidential Library catalogue record for an 1810 State Council file; no archive image or modern anthology text is redistributed.","project_id":"hist-001","query":"Russia tariff decree 1810 continental system primary source","record_sha256":"04fd9e0f66675435391fff0d136301fd609e2bb434df795018d1c497fc4f6e46","retention_policy":"paraphrase_only","retrieved_at":"2026-07-24T12:00:00Z","role":"evidence","schema_id":"tracelane://schemas/project-evidence-candidate/v1","schema_version":"1.0.0","source_candidate_content_sha256":"9d556c77aeaadfdfcc59bcbdce0ed95825dc89427f0feb44beaa87661b7a7fdc","source_candidate_id":"candidate_73605662756b5b352e0c7b63","source_candidate_record_sha256":"c1921564cf49038fec92f11dbc03178f785422f3dc1107ec9ac3b48a12b7231e","source_candidate_uri":"tracelane://artifacts/acquisition/acq_hist001_20260724/candidates/candidate_73605662756b5b352e0c7b63.json","source_spec_id":"hist001_russian_trade_1811","source_type":"primary","source_url":"https://www.prlib.ru/item/330801?mode=rusmarc","title":"Russian arrangements for foreign trade in 1811","transformation_refs":[],"trust_level":"untrusted_external"}
