{"acquisition_session_id":"acq_hist001_20260724","candidate_id":"candidate_58a3dfb2f562b9d5da7e6131","content_authorship":"repository_authored","content_ref":{"kind":"evidence_blob","media_type":"text/plain","sha256":"21df77bf225bad3608d1d0df462c19810ec6612d6c6fdb1f7fa503079d2310f2","size_bytes":433,"uri":"tracelane://evidence/blobs/sha256/21df77bf225bad3608d1d0df462c19810ec6612d6c6fdb1f7fa503079d2310f2"},"content_sha256":"21df77bf225bad3608d1d0df462c19810ec6612d6c6fdb1f7fa503079d2310f2","curator":"codex-manual","date_precision":"day","document_date":"1811-05-07","domains":["iberia"],"fact_ids":["iberia.allied_force_commitment","iberia.portuguese_finance_and_supply"],"license_basis":"Repository-authored paraphrase of a public-domain dispatch; no substantial verbatim text is redistributed.","project_id":"hist-001","query":"Wellington dispatch Peninsular War 1811 full text","record_sha256":"503b091574ba7d2074011ab61331f8ef93675000610f756c4fd2773a09c5b72b","retention_policy":"paraphrase_only","retrieved_at":"2026-07-24T12:00:00Z","role":"evidence","schema_id":"tracelane://schemas/project-evidence-candidate/v1","schema_version":"1.0.0","source_candidate_content_sha256":"21df77bf225bad3608d1d0df462c19810ec6612d6c6fdb1f7fa503079d2310f2","source_candidate_id":"candidate_58a3dfb2f562b9d5da7e6131","source_candidate_record_sha256":"ce6cf4280ec34073279181f222b01920baa8bc1bc0a28528d2ec8a5f7549aea2","source_candidate_uri":"tracelane://artifacts/acquisition/acq_hist001_20260724/candidates/candidate_58a3dfb2f562b9d5da7e6131.json","source_spec_id":"hist001_wellington_iberia_dispatch","source_type":"primary","source_url":"https://www.wtj.com/archives/wellington/1811_05b.htm","title":"Wellington to Liverpool, Villa Fermosa, 7 May 1811","transformation_refs":[],"trust_level":"untrusted_external"}
